"deal_id","deal_name","series_name","status","announcement_date","pricing_date","issue_date","maturity_date","issue_year","sponsor","issuer","cedent","country","region","sovereign_flag","government_program_flag","sovereign_or_corporate","deal_size_usd","covered_perils","covered_region","trigger_type","expected_loss","spread","risk_multiple","tranche_count","triggered_deal_flag","total_principal_loss_usd","primary_source_url","extraction_status","data_quality_score","bookrunner","broker","placement_agent"
"DL-40E16CBDA139","Photon Re Ltd. (Series 2026-1)","Series 2026-1","Outstanding","2026-01-02","2026-02-01","2026-02-01","2029-02-01","2026","Lumen Re Ltd.","Photon Re Ltd.","Lumen Re Ltd.","Canada","North America","False","False","","1468000000","US, Canada named storm and earthquake","North America","Industry loss index","0.0434","837.5","1.9297235023041477","2","False","0","https://www.artemis.bm/deal-directory/photon-re-ltd-series-2026-1/","Auto-Extracted","100.0","","",""
"DL-40E7242095DE","Nakama Re Ltd. (Series 2016-1)","Series 2016-1","Outstanding","2016-08-02","2016-09-01","2016-09-01","2019-09-02","2016","Zenkyoren","Nakama Re Ltd. (Series 2016-1)","Zenkyoren","Japan","APAC","False","False","","5138000000","Japan earthquake","APAC","Indemnity","0.49","","","2","False","0","https://www.artemis.bm/deal-directory/nakama-re-ltd-series-2016-1/","Auto-Extracted","92.3","","",""
"DL-415E116DE756","Everglades Re II Ltd. (Series 2023-1 & 2023-2)","Series 2023-1 & 2023-2","Outstanding","2023-04-01","2023-05-01","2023-05-01","2024-04-30","2023","Citizens Property Insurance","Everglades Re II Ltd.","Citizens Property Insurance","","Global","False","False","","2752500000","Florida named storm","Global","Indemnity","0.0159","8987.5","56.5251572327044","1","False","0","https://www.artemis.bm/deal-directory/everglades-re-ii-ltd-series-2023-1-2023-2/","Auto-Extracted","100.0","","",""
"DL-416BE6CCCCF1","Ibis Re Ltd. (Series 2009-1)","Series 2009-1","Outstanding","2009-03-02","2009-04-01","2009-04-01","2012-04-01","2009","Assurant","Ibis Re Ltd. (Series 2009-1)","Assurant","United States","North America","False","False","","1101000000","U.S. hurricane, U.S. earthquake","North America","Industry loss index","","","","2","False","0","https://www.artemis.bm/deal-directory/ibis-re-ltd-series-2009-1/","Auto-Extracted","76.9","","",""
"DL-417F38423B9F","Successor Hurricane Industry Ltd. (Series 3)","Series 3","Outstanding","2006-07-02","2006-08-01","2006-08-01","2009-08-01","2006","Swiss Re","Successor Hurricane Industry Ltd. (Series 3)","Swiss Re","United States","North America","False","False","","183500000","U.S. hurricane","North America","Industry loss index","","","","1","False","0","https://www.artemis.bm/deal-directory/successor-hurricane-industry-ltd-series-3/","Auto-Extracted","69.2","","",""
"DL-41810FC93C1F","Windmill I Re Ltd. (Series 2017-1)","Series 2017-1","Outstanding","2017-05-02","2017-06-01","2017-06-01","2020-06-01","2017","Achmea Reinsurance Company N.V.","Windmill I Re Ltd. (Series 2017-1)","Achmea Reinsurance Company N.V.","","Europe","False","False","","159200000","European perils","Europe","Indemnity","","","","1","False","0","https://www.artemis.bm/deal-directory/windmill-i-re-ltd-series-2017-1/","Auto-Extracted","69.2","","",""
"DL-426D0D67F563","Gateway Re Ltd. (Series 2025-3)","Series 2025-3","Outstanding","2025-06-01","2025-07-01","2025-07-01","2028-07-01","2025","Auros Reciprocal Insurance Exchange, Elevate Reciprocal Exchange","Gateway Re Ltd.","Auros Reciprocal Insurance Exchange, Elevate Reciprocal Exchange","United States","North America","False","False","","367000000","US named storm (initially Louisiana, Mississippi, South Carolina and Texas)","North America","Indemnity","0.0183","","","1","False","0","https://www.artemis.bm/deal-directory/gateway-re-ltd-series-2025-3/","Auto-Extracted","92.3","","",""
"DL-42D28B7791EE","Citrus Re Ltd. (Series 2014-2)","Series 2014-2","Outstanding","2014-03-02","2014-04-01","2014-04-01","2017-04-01","2014","Heritage Property and Casualty Insurance Co.","Citrus Re Ltd. (Series 2014-2)","Heritage Property and Casualty Insurance Co.","United States","North America","False","False","","183500000","U.S. named storms (Florida only initially)","North America","Indemnity","0.0104","375.0","3.605769230769231","1","False","0","https://www.artemis.bm/deal-directory/citrus-re-ltd-series-2014-2/","Auto-Extracted","100.0","","",""
"DL-432E718BC64C","Kizuna Re III Pte. Ltd. (Series 2021-1)","Series 2021-1","Outstanding","2021-01-30","2021-03-01","2021-03-01","2024-03-01","2021","Tokio Marine & Nichido Fire Insurance Co. Ltd.","Kizuna Re III Pte. Ltd.","Tokio Marine & Nichido Fire Insurance Co. Ltd.","Japan","APAC","False","False","","550500000","Japan earthquake","APAC","Indemnity","1.0","200.0","0.02","1","False","0","https://www.artemis.bm/deal-directory/kizuna-re-iii-pte-ltd-series-2021-1/","Auto-Extracted","92.3","","",""
"DL-434D5D1AAF25","K3 securitization","","Outstanding","2002-01-30","2002-03-01","2002-03-01","2005-03-01","2002","Hannover Re","K3 securitization","Hannover Re","Japan","APAC","False","False","","844100000","U.S. hurricane, U.S. earthquake, European windstorm, Japan earthquake","APAC","Indemnity","","","","1","False","0","https://www.artemis.bm/deal-directory/k3-securitization/","Auto-Extracted","69.2","","",""
"DL-434EF2179BE8","Hestia Re Ltd. (Series 2023-1)","Series 2023-1","Outstanding","2023-01-30","2023-03-01","2023-03-01","2026-03-01","2023","Kin Interinsurance Network","Hestia Re Ltd.","Kin Interinsurance Network","","Global","False","False","","367000000","Florida named storm","Global","Indemnity","0.0104","975.0","9.375","1","False","0","https://www.artemis.bm/deal-directory/hestia-re-ltd-series-2023-1/","Auto-Extracted","100.0","","",""
"DL-43874114D892","Merna Re II Ltd. (Series 2023-1)","Series 2023-1","Outstanding","2023-03-02","2023-04-01","2023-04-01","2026-04-01","2023","State Farm","Merna Re II Ltd.","State Farm","United States","North America","True","True","","917500000","US earthquake, US named storms (Excludes Florida on a 1st event basis. Excludes California and Texas)","North America","Indemnity","0.017","","","1","False","0","https://www.artemis.bm/deal-directory/merna-re-ii-ltd-series-2023-1/","Auto-Extracted","76.9","","",""
"DL-4388A81320AB","Pelican IV Re Ltd. (Series 2021-1)","Series 2021-1","Outstanding","2021-04-01","2021-05-01","2021-05-01","2024-05-01","2021","Louisiana Citizens Property Insurance Corporation","Pelican IV Re Ltd.","Louisiana Citizens Property Insurance Corporation","","Global","False","False","","917500000","Louisiana named storm & severe thunderstorm","Global","Indemnity","0.63","525.0","0.0833333333333333","2","False","0","https://www.artemis.bm/deal-directory/pelican-iv-re-ltd-series-2021-1/","Auto-Extracted","96.15","","",""
"DL-43B5373B3F44","Armor Re II Ltd. (Series 2019-1)","Series 2019-1","Outstanding","2019-04-01","2019-05-01","2019-05-01","2022-05-01","2019","United Property & Casualty Insurance Co., Family Security Insurance Co., Interboro Insurance Co., American Coastal Insurance","Armor Re II Ltd. (Series 2019-1)","United Property & Casualty Insurance Co., Family Security Insurance Co., Interboro Insurance Co., American Coastal Insurance","United States","North America","False","False","","734000000","U.S. named storm, U.S. earthquake","North America","Indemnity","0.0164","590.0","3.597560975609756","2","False","0","https://www.artemis.bm/deal-directory/armor-re-ii-ltd-series-2019-1/","Auto-Extracted","88.44999999999999","","",""
"DL-43CD8F07F0D3","IBRD CAR 123-124","","Outstanding","2019-10-02","2019-11-01","2019-11-01","2022-11-01","2019","Republic of the Philippines","World Bank IBRD CAR 123-124","Republic of the Philippines","","Global","True","True","","1651500000","Philippine earthquakes & tropical cyclones","Global","Modelled loss","0.03","557.5","1.8583333333333332","2","False","0","https://www.artemis.bm/deal-directory/ibrd-car-123-124/","Auto-Extracted","84.6","","",""
"DL-43EEB30A549C","Ursa Re Ltd. (Series 2015-1)","Series 2015-1","Outstanding","2015-08-02","2015-09-01","2015-09-01","2018-09-01","2015","California Earthquake Authority","Ursa Re Ltd. (Series 2015-1)","California Earthquake Authority","","Global","False","False","","917500000","California earthquake","Global","Indemnity","0.0262","500.0","1.9083969465648856","1","False","0","https://www.artemis.bm/deal-directory/ursa-re-ltd-series-2015-1/","Auto-Extracted","84.6","","",""
"DL-44CA4CBD07E1","Atlas Reinsurance VII Limited","","Outstanding","2012-10-02","2012-11-01","2012-11-01","2015-11-02","2012","SCOR","Atlas Reinsurance VII Limited","SCOR","United States","North America","False","False","","1673520000","U.S. hurricane, U.S. earthquake, European windstorm","North America","Industry loss index","0.0186","800.0","4.301075268817205","2","False","0","https://www.artemis.bm/deal-directory/atlas-reinsurance-vii-limited/","Auto-Extracted","84.6","","",""
"DL-44F865591823","Greater Bay Re Ltd. (Series 2021-1)","Series 2021-1","Outstanding","2021-08-02","2021-09-01","2021-09-01","2022-09-01","2021","China Property and Casualty Reinsurance Company (China Re)","Greater Bay Re Ltd.","China Property and Casualty Reinsurance Company (China Re)","","Global","False","False","","110100000","China typhoon risks","Global","Indemnity","","","","1","False","0","https://www.artemis.bm/deal-directory/greater-bay-re-ltd-series-2021-1/","Auto-Extracted","69.2","","",""
"DL-4530F6389D6A","Successor X Ltd. (Series 2011-2)","Series 2011-2","Outstanding","2011-01-02","2011-02-01","2011-02-01","2014-02-01","2011","Swiss Re","Successor X Ltd. (Series 2011-2)","Swiss Re","United States","North America","False","False","","1119350000","U.S. hurricane, U.S. earthquake","North America","Industry loss index","","","","1","False","0","https://www.artemis.bm/deal-directory/successor-x-ltd-series-2011-2/","Auto-Extracted","69.2","","",""
"DL-45E7C1E2F667","Javelin Re Ltd.","","Outstanding","2007-06-01","2007-07-01","2007-07-01","2010-07-01","2007","Arrow Capital Re","Javelin Re Ltd.","Arrow Capital Re","","Global","False","False","","459851000","Worldwide all risks","Global","Indemnity","","","","1","False","0","https://www.artemis.bm/deal-directory/javelin-re-ltd/","Auto-Extracted","69.2","","",""
"DL-464754050E15","Herbie Re Ltd. (Series 2020-2)","Series 2020-2","Outstanding","2020-09-01","2020-10-01","2020-10-01","2024-10-01","2020","Fidelis Insurance","Herbie Re Ltd.","Fidelis Insurance","United States","North America","False","False","","3027750000","U.S. named storm, U.S. earthquake","North America","Industry loss index","0.0207","1041.6666666666667","5.032206119162641","3","False","0","https://www.artemis.bm/deal-directory/herbie-re-ltd-series-2020-2/","Auto-Extracted","84.6","","",""
"DL-468CDFFEB8F9","Hestia Re Ltd. (Series 2025-1)","Series 2025-1","Outstanding","2025-01-30","2025-03-01","2025-03-01","2028-03-01","2025","Kin Interinsurance Network","Hestia Re Ltd.","Kin Interinsurance Network","","Global","False","False","","2202000000","Florida named storm","Global","Indemnity","0.0151","","","2","False","0","https://www.artemis.bm/deal-directory/hestia-re-ltd-series-2025-1/","Auto-Extracted","92.3","","",""
"DL-469C51931A6E","Galileo Re Ltd. (Series 2015-1)","Series 2015-1","Outstanding","2015-01-02","2015-02-01","2015-02-01","2018-02-01","2015","Catlin","Galileo Re Ltd. (Series 2015-1)","Catlin","United States","North America","False","False","","1101000000","U.S. named storms, U.S. earthquake, Canada earthquake, European windstorm","North America","Industry loss index","0.0793","1350.0","1.702395964691047","1","False","0","https://www.artemis.bm/deal-directory/galileo-re-ltd-series-2015-1/","Auto-Extracted","100.0","","",""
"DL-46D30B05DB1C","Veraison Re Ltd. (Series 2026-1)","Series 2026-1","Outstanding","2026-01-02","2026-02-01","2026-02-01","2029-02-01","2026","GeoVera Insurance","Veraison Re Ltd.","GeoVera Insurance","United States","North America","False","False","","2569000000","US earthquake","North America","Indemnity","0.75","352.5","0.047","2","False","0","https://www.artemis.bm/deal-directory/veraison-re-ltd-series-2026-1/","Auto-Extracted","100.0","","",""
"DL-4706C3224943","Arbor I Ltd. (Series 7)","Series 7","Outstanding","2004-11-01","2004-12-01","2004-12-01","2007-12-02","2004","Swiss Re","Arbor I Ltd. (Series 7)","Swiss Re","Japan","APAC","False","False","","55050000","U.S. hurricane, European windstorm, California earthquake, Japan earthquake","APAC","Parametric index","","","","1","False","0","https://www.artemis.bm/deal-directory/arbor-i-ltd-series-7/","Auto-Extracted","69.2","","",""
"DL-470726A1B031","Recoletos Re DAC (Series 2024-1)","Series 2024-1","Outstanding","2024-11-01","2024-12-01","2024-12-01","2027-12-02","2024","Mapfre Re","Recoletos Re DAC","Mapfre Re","United States","North America","False","False","","458750000","US named storm","North America","Industry loss index","0.0204","500.0","2.450980392156863","1","False","0","https://www.artemis.bm/deal-directory/recoletos-re-dac-series-2024-1/","Auto-Extracted","84.6","","",""
"DL-4758957D4429","Sanders Re III Ltd. (Series 2023-1)","Series 2023-1","Outstanding","2023-01-30","2023-03-01","2023-03-01","2027-03-01","2023","Allstate","Sanders Re III Ltd.","Allstate","United States","North America","True","True","","2752500000","US named storm, earthquake, severe weather, wildfire, volcanic eruption, meteorite impact (excl. Florida)","North America","Indemnity","0.9382","1062.5","0.113248774248561","3","False","0","https://www.artemis.bm/deal-directory/sanders-re-iii-ltd-series-2023-1/","Auto-Extracted","94.86666666666667","","",""
"DL-47B89B0C3F78","Vitality Re XV Ltd (Series 2024)","Series 2024","Outstanding","2023-12-02","2024-01-01","2024-01-01","2027-01-01","2024","Aetna","Vitality Re XV Ltd","Aetna","","Global","False","False","","1468000000","Medical benefit claims levels","Global","Medical benefit ratio (indemnity)","0.01","250.0","2.5","2","False","0","https://www.artemis.bm/deal-directory/vitality-re-xv-ltd-series-2024/","Auto-Extracted","84.6","","",""
"DL-47ECF6B8A07E","Redwood Capital VI Ltd.","","Outstanding","2004-11-01","2004-12-01","2004-12-01","2006-12-01","2004","Swiss Re","Redwood Capital VI Ltd.","Swiss Re","","Global","False","False","","550500000","California earthquake risks","Global","Industry loss index","","","","1","False","0","https://www.artemis.bm/deal-directory/redwood-capital-vi-ltd/","Auto-Extracted","69.2","","",""
"DL-4828A532BD26","East Lane Re VI Ltd. (Series 2014-1)","Series 2014-1","Outstanding","2014-01-30","2014-03-01","2014-03-01","2017-03-01","2014","Chubb","East Lane Re VI Ltd. (Series 2014-1)","Chubb","United States","North America","False","False","","990900000","U.S. named storms, earthquakes, severe thunderstorms and winter storms","North America","Indemnity","0.82","275.0","0.0335365853658536","1","False","0","https://www.artemis.bm/deal-directory/east-lane-re-vi-ltd-series-2014-1/","Auto-Extracted","100.0","","",""
"DL-4884B7FD83C4","Foundation Re IV Ltd. (Series 2026-1)","Series 2026-1","Outstanding","2025-11-01","2025-12-01","2025-12-01","2028-12-01","2025","Hartford Fire Insurance Co.","Foundation Re IV Ltd.","Hartford Fire Insurance Co.","United States","North America","False","False","","990900000","US named storm, US earthquake","North America","Indemnity","0.0118","350.0000000000001","2.9661016949152548","1","False","0","https://www.artemis.bm/deal-directory/foundation-re-iv-ltd-series-2026-1/","Auto-Extracted","100.0","","",""
"DL-48E51EA7D9BE","Four Lakes Re Ltd. (Series 2025-1)","Series 2025-1","Outstanding","2025-11-01","2025-12-01","2025-12-01","2028-12-01","2025","American Family Mutual Insurance Co.","Four Lakes Re Ltd.","American Family Mutual Insurance Co.","","Global","False","False","","1468000000","U.S named storm, earthquake, severe thunderstorm, winter storm, wildfire","Global","Indemnity","0.85","462.5","0.0544117647058823","2","False","0","https://www.artemis.bm/deal-directory/four-lakes-re-ltd-series-2025-1/","Auto-Extracted","100.0","","",""
"DL-492435613246","Muteki Ltd.","","Outstanding","2008-04-01","2008-05-01","2008-05-01","2013-05-01","2008","Zenkyoren","Muteki Ltd.","Zenkyoren","Japan","APAC","False","False","","1101000000","Japan earthquake","APAC","Parametric index","","","","1","False","0","https://www.artemis.bm/deal-directory/muteki-ltd/","Auto-Extracted","69.2","","",""
"DL-4924FF6D0E44","Citrus Re Ltd. (Series 2015-1)","Series 2015-1","Outstanding","2015-03-02","2015-04-01","2015-04-01","2018-04-01","2015","Heritage Property and Casualty Insurance Co.","Citrus Re Ltd. (Series 2015-1)","Heritage Property and Casualty Insurance Co.","United States","North America","False","False","","3055275000","U.S. named storms (Florida only initially)","North America","Indemnity","0.0122","687.5","5.635245901639344","3","False","0","https://www.artemis.bm/deal-directory/citrus-re-ltd-series-2015-1/","Auto-Extracted","97.43333333333334","","",""
"DL-493AEB22CCF8","FloodSmart Re Ltd. (Series 2023-1)","Series 2023-1","Outstanding","2023-01-30","2023-03-01","2023-03-01","2026-03-01","2023","FEMA / NFIP via Hannover Re","FloodSmart Re Ltd.","FEMA / NFIP via Hannover Re","United States","North America","False","False","","2018500000","U.S. flood risk (from named storms)","North America","Indemnity","0.0535","1462.5","2.733644859813084","2","False","0","https://www.artemis.bm/deal-directory/floodsmart-re-ltd-series-2023-1/","Auto-Extracted","100.0","","",""
"DL-4A0A9139E804","Residential Reinsurance 2011 Ltd. (Series 2011-1)","Series 2011-1","Outstanding","2011-04-01","2011-05-01","2011-05-01","2014-05-01","2011","USAA","Residential Reinsurance 2011 Ltd. (Series 2011-1)","USAA","United States","North America","False","False","","2752500000","U.S. hurricane, U.S. earthquake, U.S. severe thunderstorm, U.S. winter storm, U.S. wildfire","North America","Indemnity","","","","3","False","0","https://www.artemis.bm/deal-directory/residential-reinsurance-2011-ltd-series-2011-1/","Auto-Extracted","84.6","","",""
"DL-4A0C87388B76","Ursa Re Ltd. (Series 2025-1)","Series 2025-1","Outstanding","2025-01-02","2025-02-01","2025-02-01","2028-02-02","2025","California Earthquake Authority","Ursa Re Ltd.","California Earthquake Authority","","Global","False","False","","1468000000","California earthquake","Global","Indemnity","0.0405","750.0","1.851851851851852","1","False","0","https://www.artemis.bm/deal-directory/ursa-re-ltd-series-2025-1/","Auto-Extracted","84.6","","",""
"DL-4A502841252A","Herbie Re Ltd. (Series 2025-1)","Series 2025-1","Outstanding","2025-04-01","2025-05-01","2025-05-01","2027-05-01","2025","Fidelis Insurance","Herbie Re Ltd.","Fidelis Insurance","Japan","APAC","False","False","","330300000","North America named storm, North America earthquake, US severe thunderstorm, US wildfire, US winter storms, US Caribbean earthquake, Japan typhoon, Japan earthquake, Canada severe storm, Canada winter storm, European windstorm, Italy earthquake, Turkey earthquake, Australia earthquake, Australia tropical cyclone, NZ earthquake","APAC","Industry loss index","0.0878999999999999","310.0","0.3526734926052332","1","False","0","https://www.artemis.bm/deal-directory/herbie-re-ltd-series-2025-1/","Auto-Extracted","100.0","","",""
"DL-4A53ADB09037","Purple Re Ltd. (Series 2026-1)","Series 2026-1","Outstanding","2026-01-02","2026-02-01","2026-02-01","2029-02-01","2026","Slide Insurance Company","Purple Re Ltd.","Slide Insurance Company","","Global","False","False","","1174400000","Florida, South Carolina, Rhode Island, New Jersey, New York named storm","Global","Indemnity","0.0169","650.0","3.846153846153847","1","False","0","https://www.artemis.bm/deal-directory/purple-re-ltd-series-2026-1/","Auto-Extracted","100.0","","",""
"DL-4A673E401430","Tomoni Re Pte Ltd. (Series 2024-1)","Series 2024-1","Outstanding","2024-01-31","2024-03-01","2024-03-01","2028-03-01","2024","Mitsui Sumitomo Insurance Co. Ltd., Aioi Nissay Dowa Insurance Co., Ltd.","Tomoni Re Pte Ltd.","Mitsui Sumitomo Insurance Co. Ltd., Aioi Nissay Dowa Insurance Co., Ltd.","Japan","APAC","False","False","","1468000000","Japan typhoon, Japan flood, Japan earthquake","APAC","Indemnity","0.0145","325.0","2.2413793103448274","2","False","0","https://www.artemis.bm/deal-directory/tomoni-re-pte-ltd-series-2024-1/","Auto-Extracted","84.6","","",""
"DL-4A7E3249CC3E","Caelus Re II Ltd.","","Outstanding","2010-04-01","2010-05-01","2010-05-01","2013-05-01","2010","Nationwide Mutual Insurance Co.","Caelus Re II Ltd.","Nationwide Mutual Insurance Co.","United States","North America","False","False","","678950000","U.S. hurricane, U.S. earthquake","North America","Indemnity","","","","1","False","0","https://www.artemis.bm/deal-directory/caelus-re-ii-ltd/","Auto-Extracted","69.2","","",""
"DL-4ABE0D4984F8","Cape Lookout Re Ltd. (Series 2024-1)","Series 2024-1","Outstanding","2024-01-31","2024-03-01","2024-03-01","2027-03-02","2024","North Carolina Insurance Underwriting Association","Cape Lookout Re Ltd.","North Carolina Insurance Underwriting Association","","Global","False","False","","1651500000","North Carolina named storm","Global","Indemnity","0.0256","","","1","False","0","https://www.artemis.bm/deal-directory/cape-lookout-re-ltd-series-2024-1/","Auto-Extracted","92.3","","",""
"DL-4ABEB1AB06B8","Four Lakes Re Ltd. (Series 2021-1)","Series 2021-1","Outstanding","2021-11-01","2021-12-01","2021-12-01","2024-12-01","2021","American Family Mutual Insurance Co.","Four Lakes Re Ltd.","American Family Mutual Insurance Co.","","Global","False","False","","458750000","U.S named storm, earthquake, severe thunderstorm, winter storm, wildfire, volcanic eruption, meteorite impact","Global","Indemnity","0.0137","475.0","3.4671532846715327","1","False","0","https://www.artemis.bm/deal-directory/four-lakes-re-ltd-series-2021-1/","Auto-Extracted","100.0","","",""
"DL-4AE1E4DF29F7","Marlin Re Ltd. (Series 2022-1)","Series 2022-1","Outstanding","2022-05-02","2022-06-01","2022-06-01","2024-05-31","2022","Weston Property and Casualty Insurance Company","Marlin Re Ltd.","Weston Property and Casualty Insurance Company","","Global","False","False","","0","Florida, Louisiana, Mississippi, Texas and South Carolina named storms","Global","Indemnity","0.0288","1600.0","5.555555555555556","3","False","0","https://www.artemis.bm/deal-directory/marlin-re-ltd-series-2022-1/","Auto-Extracted","79.46666666666667","","",""
"DL-4AEE51655F8E","Cape Lookout Re Ltd. (Series 2021-1)","Series 2021-1","Outstanding","2021-01-30","2021-03-01","2021-03-01","2024-03-01","2021","North Carolina Insurance Underwriting Association","Cape Lookout Re Ltd.","North Carolina Insurance Underwriting Association","","Global","False","False","","917500000","North Carolina named storm & severe thunderstorm","Global","Indemnity","0.0104","325.0","3.1250000000000004","1","False","0","https://www.artemis.bm/deal-directory/cape-lookout-re-ltd-series-2021-1/","Auto-Extracted","84.6","","",""
"DL-4B003EB840E1","Windmill I Re Ltd. (Series 2013-1)","Series 2013-1","Outstanding","2013-11-01","2013-12-01","2013-12-01","2016-12-01","2013","Achmea Reinsurance Company N.V.","Windmill I Re Ltd. (Series 2013-1)","Achmea Reinsurance Company N.V.","","Europe","False","False","","159200000","European windstorm","Europe","Indemnity","0.0325","325.0","1.0","1","False","0","https://www.artemis.bm/deal-directory/windmill-i-re-ltd-series-2013-1/","Auto-Extracted","84.6","","",""
"DL-4B340184FA33","Residential Reinsurance 2021 Limited (Series 2021-1)","Series 2021-1","Outstanding","2021-04-01","2021-05-01","2021-05-01","2024-05-01","2021","USAA","Residential Reinsurance 2021 Limited","USAA","United States","North America","False","False","","5872000000","U.S. tropical cyclones, earthquakes (plus fire following), severe thunderstorm, winter storm, wildfire, volcanic eruption, meteorite impact, other perils (all including auto & renter policy flood losses)","North America","","0.0432","","","4","False","0","https://www.artemis.bm/deal-directory/residential-reinsurance-2021-limited-series-2021-1/","Auto-Extracted","84.6","","",""
"DL-4BDAC7BA1D18","Studio Re Ltd.","","Outstanding","2002-11-01","2002-12-01","2002-12-01","2005-12-01","2002","Vivendi Universal SA","Studio Re Ltd.","Vivendi Universal SA","","Global","False","False","","642250000","California earthquake risks","Global","Parametric index","","","","1","False","0","https://www.artemis.bm/deal-directory/studio-re-ltd/","Auto-Extracted","69.2","","",""
"DL-4C68A9EEDA5E","Vitality Re XI Ltd. (Series 2020)","Series 2020","Outstanding","2019-12-02","2020-01-01","2020-01-01","2023-01-01","2020","Aetna","Vitality Re XI Ltd.","Aetna","","Global","False","False","","1468000000","Medical benefit claims levels","Global","Medical benefit ratio (indemnity)","0.01","162.5","1.625","2","False","0","https://www.artemis.bm/deal-directory/vitality-re-xi-ltd-series-2020/","Auto-Extracted","84.6","","",""
"DL-4C9F2493328E","Pylon Ltd.","","Outstanding","2003-11-01","2003-12-01","2003-12-01","2008-11-30","2003","Electricité de France (EDF)","Pylon Ltd.","Electricité de France (EDF)","","Europe","False","False","","836760000","European windstorm","Europe","Parametric index","","","","1","False","0","https://www.artemis.bm/deal-directory/pylon-ltd/","Auto-Extracted","69.2","","",""
"DL-4CDAC4EB211F","Sabine Re Ltd. (Series 2024-1)","Series 2024-1","Outstanding","2024-03-02","2024-04-01","2024-04-01","2027-04-02","2024","Allied Trust Insurance Company","Sabine Re Ltd.","Allied Trust Insurance Company","","Global","False","False","","367000000","Named storm: Texas, North Carolina, South Carolina, Louisiana","Global","Indemnity","0.0148","825.0","5.574324324324325","1","False","0","https://www.artemis.bm/deal-directory/sabine-re-ltd-series-2024-1/","Auto-Extracted","100.0","","",""
